author,title,selftext,created_utc,id,num_comments,score,subreddit
BorisKapichkov1986,Somebody’s spreading the truth,,1580702581,ey12f7,2,1,JusticeForJohnnyDepp
HWGA_Gallifrey,"""Litigation Vs. Accusation""",,1581139945,f0n8wu,0,1,JusticeForJohnnyDepp
HWGA_Gallifrey,The cultural amnesia and victim blaming after they crucified Depp in the court of public opinion is staggering. Their silence is deafening.,,1581140216,f0nam9,0,1,JusticeForJohnnyDepp
HWGA_Gallifrey,“See How Many People Believe or Side With You” -Amber Heard,,1581140286,f0nb3f,0,1,JusticeForJohnnyDepp
HWGA_Gallifrey,Amber Heard BRAGS No One Will Believe Johnny Depp Because She Is A Woman,,1581140381,f0nbmy,0,1,JusticeForJohnnyDepp
HWGA_Gallifrey,Johnny Depp &amp; Amber Heard: NEW Unsensored Audio - Amber tells Depp nobody will believe him.,,1581201268,f0yz17,1,1,JusticeForJohnnyDepp
capn_meow,This article makes me sick,,1581286190,f1g26y,1,1,JusticeForJohnnyDepp
HWGA_Gallifrey,Not hard to imagine what J.D. went through with her...,,1581544526,f2yvk4,2,1,JusticeForJohnnyDepp
Bazingagirl21,Bring Johnny Depp back as Captain Jack Sparrow. He is an amazing actor that doesn't deserve to be abused.,,1581765219,f483dj,2,1,JusticeForJohnnyDepp
Justiceforjohnny,Hhmmmm,,1592015851,h7yvv2,0,5,JusticeForJohnnyDepp
HotMomentumStocks,"At libel trial, Johnny Depp blasts Amber Heard's 'sick' abuse claim",,1594156486,hn39kx,0,1,JusticeForJohnnyDepp
EmiPendle78,This should become universal!,"In my household now, whenever there is need mention of a 💩, for instance; “The dog has shat/crapped/done a turd/pooed/pooped, on the floor.” We now refer to it as an “Amber”. For example; ”That fugly biatch laid a massive Amber on Mr. Depp’s bed!",1594982056,hsteex,2,1,JusticeForJohnnyDepp
arlomilano,Meme,,1595443027,hvzbi0,0,9,JusticeForJohnnyDepp
JSG-YT,Amber heards new soon to be look,,1595702195,hxrpte,0,1,JusticeForJohnnyDepp
LooseScrews23,Amber Heard is crazy...,,1595794082,hydrlk,1,1,JusticeForJohnnyDepp
MudslimeCleaner,"I'm always eager to get more coverage, but why does 60 Minutes Australia have to consistently be such a steaming pile of trash? Here's a new video recapping the trial... if any of you can make it through their insanely biased piece.",,1596386717,i2f5pe,2,1,JusticeForJohnnyDepp
Ex_Rev_Mathew_Mara,Amber’s sister is sweating.,,1596829475,i5kmgo,1,1,JusticeForJohnnyDepp
cocky_tree,We need more people for this community.,Share this group among the subreddit community. we need more manpower to aid Johnny. share Share share.,1597468545,ia1qra,3,1,JusticeForJohnnyDepp
AnEmptyCup08,I just dealt with a Turd supporter,"So me being the angsty teen I am, has tumblr. Now out of the blue, in the Justice fo Johnny Depp tag, I see some bitch raging about how we were all blind and stupid. I asked her, why she supported Amber, not just against Johnny, but in general, after she stole a womans rape story, was abusive, and that there was mountains of evidence against her. The response? One paragraph of bullshit about her bruises, with a clearly edited Wikipedia article about abuse. Heard supporters are either abusers themselves or just plain idiots",1597483051,ia4b72,6,1,JusticeForJohnnyDepp
Reyzorblade,Here's a playlist of very insightful videos by a psychologist specializing in abuse related to Cluster B disorders analyzing Amber Heard's abuse of Johnny Depp.,,1597486414,ia4w01,2,1,JusticeForJohnnyDepp
annaaii,"Unsurprisingly, Turd supporters still use the full kitchen video to defend her","I'd lie if I said I didn't expect this. I knew from the moment I heard the full version was shown in court that once it is released to the public they'll find a way to twist it and make it look like it's Johnny's fault. It goes without saying that none of it makes sense but what I do wonder is why they don't address the fact that the video was edited in the first place. They claim the video clearly shows Johnny being abusive, so if that's the case, why bother editing it in the first place? 

Just wondering if anyone has seen any ridiculous explanation for this?",1597565287,iaoozp,9,1,JusticeForJohnnyDepp
remooseloopin,hmmm...,,1597866015,icur6v,6,1,JusticeForJohnnyDepp
remooseloopin,"Amber Heard asking Johnny's assistants where his phone his coz she wants to ""track him down""",,1598083764,ieeqjp,1,1,JusticeForJohnnyDepp
OREOicescream,.,,1600709877,ix5583,2,1,JusticeForJohnnyDepp
pennymanalo,#justiceforjohnnydepp,"[incredibly average](https://www.youtube.com/channel/UCg0C-N_MPYYOXyF4T3jMxNQ)

I would love to see captain jack sparrow back! 
Looks can be deceiving. Beauty doesnt mean perfect some are koo koo.
Not all abused are women. Like amber the abuser turd.
Disney needs to apologise to Johnny and that succubus needs to go to jail or looney house. 
Disappointed with Elon Musk, Leo di caprio, james franco. Doing that to JD for her cunt.",1602941226,jcv38q,0,1,JusticeForJohnnyDepp
